{"caveat":"Exploratory description of where a straight-line fit bends, not a detection of regime shifts. Break years depend on the chosen minimum segment length, the grid step and autocorrelation; the intervals are bootstrap intervals conditional on the selected model. Do not read a break as a cause. When the selected k equals the search maximum (3) the data would accept even more breaks, which is a sign of a smooth, curved trend rather than of discrete shifts.","method":{"autocorrelation_note":"Plain BIC over-selects breaks for positively autocorrelated residuals; the n_eff adjustment is a mitigation, not a cure.","block_len":10,"max_breaks":3,"min_segment_years":15,"model":"continuous piecewise-linear (hinge) regression on annual global anomalies, breaks found by exhaustive least-squares search","n_boot":200,"selection":"AR(1)-adjusted BIC: -2 logL scaled to n_eff = n (1 - r1) / (1 + r1) of each model's own residuals; penalty (2 + 2k + 1) ln(n_eff). k = 3 searched on a 2-year grid, k <= 2 on a 1-year grid"},"results":[{"break_ci_95":[[1904.0,1920.0],[1930.0,1954.0],[1966.0,1978.0]],"candidates":[{"bic":-45.341,"breaks":[],"k":0,"slopes_per_decade":[0.0826],"sse":5.44894},{"bic":-170.405,"breaks":[1975],"k":1,"slopes_per_decade":[0.0358,0.2054],"sse":1.99459},{"bic":-207.025,"breaks":[1909,1985],"k":2,"slopes_per_decade":[-0.0468,0.0636,0.2269],"sse":1.70762},{"bic":-269.759,"breaks":[1912,1942,1972],"k":3,"slopes_per_decade":[-0.0625,0.1222,-0.0142,0.2046],"sse":1.45319}],"end":2025,"fit":{"1951-1980":[null,null,null,null,null,null,null,null,null,null,null,null,null,null,null,null,null,null,null,null,null,null,null,null,null,null,null,null,null,null,-0.167,-0.173,-0.18,-0.186,-0.192,-0.198,-0.205,-0.211,-0.217,-0.223,-0.23,-0.236,-0.242,-0.248,-0.255,-0.261,-0.267,-0.273,-0.28,-0.286,-0.292,-0.298,-0.305,-0.311,-0.317,-0.323,-0.33,-0.336,-0.342,-0.348,-0.355,-0.361,-0.367,-0.355,-0.343,-0.33,-0.318,-0.306,-0.294,-0.281,-0.269,-0.257,-0.245,-0.233,-0.22,-0.208,-0.196,-0.184,-0.171,-0.159,-0.147,-0.135,-0.123,-0.11,-0.098,-0.086,-0.074,-0.061,-0.049,-0.037,-0.025,-0.013,-0.0,-0.002,-0.003,-0.005,-0.006,-0.007,-0.009,-0.01,-0.012,-0.013,-0.015,-0.016,-0.017,-0.019,-0.02,-0.022,-0.023,-0.024,-0.026,-0.027,-0.029,-0.03,-0.032,-0.033,-0.034,-0.036,-0.037,-0.039,-0.04,-0.041,-0.043,-0.022,-0.002,0.018,0.039,0.059,0.08,0.1,0.121,0.141,0.162,0.182,0.203,0.223,0.243,0.264,0.284,0.305,0.325,0.346,0.366,0.387,0.407,0.428,0.448,0.468,0.489,0.509,0.53,0.55,0.571,0.591,0.612,0.632,0.653,0.673,0.694,0.714,0.734,0.755,0.775,0.796,0.816,0.837,0.857,0.878,0.898,0.919,0.939,0.959,0.98,1.0,1.021,1.041],"1991-2020":[null,null,null,null,null,null,null,null,null,null,null,null,null,null,null,null,null,null,null,null,null,null,null,null,null,null,null,null,null,null,-0.779,-0.785,-0.791,-0.797,-0.804,-0.81,-0.816,-0.822,-0.829,-0.835,-0.841,-0.847,-0.854,-0.86,-0.866,-0.872,-0.879,-0.885,-0.891,-0.897,-0.904,-0.91,-0.916,-0.922,-0.929,-0.935,-0.941,-0.947,-0.954,-0.96,-0.966,-0.972,-0.979,-0.966,-0.954,-0.942,-0.93,-0.917,-0.905,-0.893,-0.881,-0.869,-0.856,-0.844,-0.832,-0.82,-0.807,-0.795,-0.783,-0.771,-0.759,-0.746,-0.734,-0.722,-0.71,-0.697,-0.685,-0.673,-0.661,-0.649,-0.636,-0.624,-0.612,-0.613,-0.615,-0.616,-0.618,-0.619,-0.62,-0.622,-0.623,-0.625,-0.626,-0.627,-0.629,-0.63,-0.632,-0.633,-0.635,-0.636,-0.637,-0.639,-0.64,-0.642,-0.643,-0.644,-0.646,-0.647,-0.649,-0.65,-0.652,-0.653,-0.654,-0.634,-0.613,-0.593,-0.573,-0.552,-0.532,-0.511,-0.491,-0.47,-0.45,-0.429,-0.409,-0.388,-0.368,-0.348,-0.327,-0.307,-0.286,-0.266,-0.245,-0.225,-0.204,-0.184,-0.163,-0.143,-0.123,-0.102,-0.082,-0.061,-0.041,-0.02,0.0,0.021,0.041,0.062,0.082,0.102,0.123,0.143,0.164,0.184,0.205,0.225,0.246,0.266,0.287,0.307,0.327,0.348,0.368,0.389,0.409,0.43]},"selected_breaks":[1912,1942,1972],"selected_k":3,"selected_slopes_per_decade":[-0.0625,0.1222,-0.0142,0.2046],"series_id":"gistemp_glb","start":1880,"years":[1850,1851,1852,1853,1854,1855,1856,1857,1858,1859,1860,1861,1862,1863,1864,1865,1866,1867,1868,1869,1870,1871,1872,1873,1874,1875,1876,1877,1878,1879,1880,1881,1882,1883,1884,1885,1886,1887,1888,1889,1890,1891,1892,1893,1894,1895,1896,1897,1898,1899,1900,1901,1902,1903,1904,1905,1906,1907,1908,1909,1910,1911,1912,1913,1914,1915,1916,1917,1918,1919,1920,1921,1922,1923,1924,1925,1926,1927,1928,1929,1930,1931,1932,1933,1934,1935,1936,1937,1938,1939,1940,1941,1942,1943,1944,1945,1946,1947,1948,1949,1950,1951,1952,1953,1954,1955,1956,1957,1958,1959,1960,1961,1962,1963,1964,1965,1966,1967,1968,1969,1970,1971,1972,1973,1974,1975,1976,1977,1978,1979,1980,1981,1982,1983,1984,1985,1986,1987,1988,1989,1990,1991,1992,1993,1994,1995,1996,1997,1998,1999,2000,2001,2002,2003,2004,2005,2006,2007,2008,2009,2010,2011,2012,2013,2014,2015,2016,2017,2018,2019,2020,2021,2022,2023,2024,2025]},{"break_ci_95":[[1903.95,1920.05],[1930.0,1950.0],[1966.0,1974.05]],"candidates":[{"bic":-42.646,"breaks":[],"k":0,"slopes_per_decade":[0.0666],"sse":7.98996},{"bic":-177.366,"breaks":[1974],"k":1,"slopes_per_decade":[0.0295,0.2089],"sse":2.8049},{"bic":-225.225,"breaks":[1904,1984],"k":2,"slopes_per_decade":[-0.0121,0.0595,0.2262],"sse":2.37947},{"bic":-355.672,"breaks":[1912,1940,1970],"k":3,"slopes_per_decade":[-0.0203,0.15,-0.046,0.2069],"sse":1.81209}],"end":2025,"fit":{"1850-1900":[0.041,0.039,0.037,0.035,0.033,0.031,0.029,0.027,0.025,0.023,0.021,0.019,0.017,0.015,0.013,0.011,0.009,0.007,0.005,0.003,0.0,-0.002,-0.004,-0.006,-0.008,-0.01,-0.012,-0.014,-0.016,-0.018,-0.02,-0.022,-0.024,-0.026,-0.028,-0.03,-0.032,-0.034,-0.036,-0.038,-0.04,-0.042,-0.044,-0.046,-0.048,-0.05,-0.052,-0.054,-0.056,-0.058,-0.061,-0.063,-0.065,-0.067,-0.069,-0.071,-0.073,-0.075,-0.077,-0.079,-0.081,-0.083,-0.085,-0.07,-0.055,-0.04,-0.025,-0.01,0.005,0.02,0.035,0.05,0.065,0.08,0.095,0.11,0.125,0.14,0.155,0.17,0.185,0.2,0.215,0.23,0.245,0.26,0.275,0.29,0.305,0.32,0.335,0.33,0.326,0.321,0.317,0.312,0.307,0.303,0.298,0.294,0.289,0.284,0.28,0.275,0.271,0.266,0.261,0.257,0.252,0.248,0.243,0.238,0.234,0.229,0.225,0.22,0.215,0.211,0.206,0.202,0.197,0.218,0.238,0.259,0.28,0.301,0.321,0.342,0.363,0.383,0.404,0.425,0.445,0.466,0.487,0.507,0.528,0.549,0.57,0.59,0.611,0.632,0.652,0.673,0.694,0.714,0.735,0.756,0.776,0.797,0.818,0.838,0.859,0.88,0.901,0.921,0.942,0.963,0.983,1.004,1.025,1.045,1.066,1.087,1.107,1.128,1.149,1.17,1.19,1.211,1.232,1.252,1.273,1.294,1.314,1.335],"1951-1980":[-0.235,-0.237,-0.239,-0.241,-0.243,-0.245,-0.247,-0.25,-0.252,-0.254,-0.256,-0.258,-0.26,-0.262,-0.264,-0.266,-0.268,-0.27,-0.272,-0.274,-0.276,-0.278,-0.28,-0.282,-0.284,-0.286,-0.288,-0.29,-0.292,-0.294,-0.296,-0.298,-0.3,-0.302,-0.304,-0.306,-0.308,-0.311,-0.313,-0.315,-0.317,-0.319,-0.321,-0.323,-0.325,-0.327,-0.329,-0.331,-0.333,-0.335,-0.337,-0.339,-0.341,-0.343,-0.345,-0.347,-0.349,-0.351,-0.353,-0.355,-0.357,-0.359,-0.361,-0.346,-0.331,-0.316,-0.301,-0.286,-0.271,-0.256,-0.241,-0.226,-0.211,-0.196,-0.181,-0.166,-0.151,-0.136,-0.121,-0.106,-0.091,-0.076,-0.061,-0.046,-0.031,-0.016,-0.001,0.014,0.029,0.044,0.059,0.054,0.049,0.045,0.04,0.036,0.031,0.026,0.022,0.017,0.013,0.008,0.003,-0.001,-0.006,-0.01,-0.015,-0.02,-0.024,-0.029,-0.033,-0.038,-0.043,-0.047,-0.052,-0.056,-0.061,-0.066,-0.07,-0.075,-0.079,-0.059,-0.038,-0.017,0.003,0.024,0.045,0.065,0.086,0.107,0.128,0.148,0.169,0.19,0.21,0.231,0.252,0.272,0.293,0.314,0.334,0.355,0.376,0.397,0.417,0.438,0.459,0.479,0.5,0.521,0.541,0.562,0.583,0.603,0.624,0.645,0.666,0.686,0.707,0.728,0.748,0.769,0.79,0.81,0.831,0.852,0.872,0.893,0.914,0.934,0.955,0.976,0.997,1.017,1.038,1.059],"1991-2020":[-0.866,-0.869,-0.871,-0.873,-0.875,-0.877,-0.879,-0.881,-0.883,-0.885,-0.887,-0.889,-0.891,-0.893,-0.895,-0.897,-0.899,-0.901,-0.903,-0.905,-0.907,-0.909,-0.911,-0.913,-0.915,-0.917,-0.919,-0.921,-0.923,-0.925,-0.927,-0.93,-0.932,-0.934,-0.936,-0.938,-0.94,-0.942,-0.944,-0.946,-0.948,-0.95,-0.952,-0.954,-0.956,-0.958,-0.96,-0.962,-0.964,-0.966,-0.968,-0.97,-0.972,-0.974,-0.976,-0.978,-0.98,-0.982,-0.984,-0.986,-0.988,-0.991,-0.993,-0.978,-0.963,-0.948,-0.933,-0.918,-0.903,-0.888,-0.873,-0.858,-0.843,-0.828,-0.813,-0.798,-0.783,-0.768,-0.753,-0.738,-0.723,-0.708,-0.693,-0.678,-0.663,-0.648,-0.633,-0.618,-0.603,-0.588,-0.573,-0.577,-0.582,-0.586,-0.591,-0.596,-0.6,-0.605,-0.609,-0.614,-0.619,-0.623,-0.628,-0.632,-0.637,-0.642,-0.646,-0.651,-0.655,-0.66,-0.665,-0.669,-0.674,-0.678,-0.683,-0.688,-0.692,-0.697,-0.701,-0.706,-0.711,-0.69,-0.669,-0.648,-0.628,-0.607,-0.586,-0.566,-0.545,-0.524,-0.504,-0.483,-0.462,-0.442,-0.421,-0.4,-0.379,-0.359,-0.338,-0.317,-0.297,-0.276,-0.255,-0.235,-0.214,-0.193,-0.173,-0.152,-0.131,-0.111,-0.09,-0.069,-0.048,-0.028,-0.007,0.014,0.034,0.055,0.076,0.096,0.117,0.138,0.158,0.179,0.2,0.221,0.241,0.262,0.283,0.303,0.324,0.345,0.365,0.386,0.407,0.427]},"selected_breaks":[1912,1940,1970],"selected_k":3,"selected_slopes_per_decade":[-0.0203,0.15,-0.046,0.2069],"series_id":"hadcrut5_glb","start":1850,"years":[1850,1851,1852,1853,1854,1855,1856,1857,1858,1859,1860,1861,1862,1863,1864,1865,1866,1867,1868,1869,1870,1871,1872,1873,1874,1875,1876,1877,1878,1879,1880,1881,1882,1883,1884,1885,1886,1887,1888,1889,1890,1891,1892,1893,1894,1895,1896,1897,1898,1899,1900,1901,1902,1903,1904,1905,1906,1907,1908,1909,1910,1911,1912,1913,1914,1915,1916,1917,1918,1919,1920,1921,1922,1923,1924,1925,1926,1927,1928,1929,1930,1931,1932,1933,1934,1935,1936,1937,1938,1939,1940,1941,1942,1943,1944,1945,1946,1947,1948,1949,1950,1951,1952,1953,1954,1955,1956,1957,1958,1959,1960,1961,1962,1963,1964,1965,1966,1967,1968,1969,1970,1971,1972,1973,1974,1975,1976,1977,1978,1979,1980,1981,1982,1983,1984,1985,1986,1987,1988,1989,1990,1991,1992,1993,1994,1995,1996,1997,1998,1999,2000,2001,2002,2003,2004,2005,2006,2007,2008,2009,2010,2011,2012,2013,2014,2015,2016,2017,2018,2019,2020,2021,2022,2023,2024,2025]}],"schema_version":"v1","status":"EXPLORATORY","tags":{"caveat":"DERIVED","results":"DERIVED","status":"DERIVED"}}
